{
  "action": "updated",
  "deployment_id": "22222222-2222-4222-8222-222222222222",
  "geometry_ref": "urn:sha256:4444444444444444444444444444444444444444444444444444444444444444",
  "geometry_type": "volume",
  "occurred_at": "2026-07-17T12:05:00.000000Z",
  "revision": 2,
  "schema_version": "1.0.0",
  "zone_id": "zone-a"
}
